{
  "task_id": "example-comms-draft-reply",
  "idempotency_key": "idem-example-comms-draft-reply",
  "capability": "comms.draft_reply",
  "task_type": "draft_reply",
  "input": {
    "message_uri": "imap://inbox/123",
    "tone": "professional"
  },
  "constraints": {
    "max_runtime_seconds": 300,
    "network_policy": "restricted",
    "allowed_domains": [],
    "write_scope": "task"
  },
  "policy": {
    "decision": "allowed",
    "reason": "example policy decision",
    "policy_version": "v0.1"
  },
  "provenance": {
    "example": true
  }
}
