{
  "task_id": "example-browser-extract",
  "idempotency_key": "idem-example-browser-extract",
  "capability": "browser.extract",
  "task_type": "extract_page",
  "input": {
    "url": "https://example.com",
    "selectors": {
      "title": "h1"
    }
  },
  "constraints": {
    "max_runtime_seconds": 300,
    "network_policy": "restricted",
    "allowed_domains": [],
    "write_scope": "task"
  },
  "policy": {
    "decision": "allowed",
    "reason": "allowed domain read-only extraction",
    "policy_version": "v0.1"
  },
  "provenance": {
    "example": true
  }
}
