{
  "task_id": "example-records-create-lead",
  "idempotency_key": "idem-example-records-create-lead",
  "capability": "records.create",
  "task_type": "create_lead",
  "input": {
    "lead": {
      "email": "buyer@example.com"
    }
  },
  "constraints": {
    "max_runtime_seconds": 300,
    "network_policy": "restricted",
    "allowed_domains": [],
    "write_scope": "task"
  },
  "policy": {
    "decision": "requires_approval",
    "reason": "Task mutates external systems",
    "policy_version": "v0.1"
  },
  "provenance": {
    "example": true
  }
}
